<?xml version="1.0" encoding="UTF-8" ?>
<customer xmlns:xsi="http://www.w3.org/2001/XMLSchema-instance"
          xsi:schemaLocation="http://xmlns.darwin-it.nl/xsd/demo/Customer ../Schemas/Customer.xsd"
          xmlns="http://xmlns.darwin-it.nl/xsd/demo/Customer">
  <id>1002</id>
  <firstName>Mike</firstName>
  <lastName>Oldfield</lastName>  
  <gender>M</gender>
  <streetName>Platinum</streetName>
  <houseNumber>1979</houseNumber>
  <country>London</country>
</customer>
